{
  "schema_version": "1.0",
  "incompatible_baseline": "ERROR",
  "baseline_path": "baseline-report.json",
  "external_afdocs_required": false,
  "rules": [
    {
      "rule_id": "DART-OPS-001",
      "finding_status": "FAIL",
      "effect": "BLOCKING"
    },
    {
      "regression_state": "CHANGED",
      "effect": "BLOCKING"
    }
  ]
}
